id,place_id,name,sub_area,latitude,longitude,address,contact,is_closed,area,description,phone,reservation,hours_text,holiday_note,hours_mon,hours_tue,hours_wed,hours_thu,hours_fri,hours_sat,hours_sun,link_website,link_instagram,link_x,link_tabelog,dog_indoor,dog_terrace,dog_large,dog_menu,dog_size_limit,dog_note,info_verified,insta_note,insta_note_date
beef0000-0000-4000-8000-000000000449,,leafis cafe ASAGAYA(リーフィスカフェ阿佐ヶ谷),高円寺・荻窪,35.71080,139.63000,東京都杉並区本天沼1-28-14 エヴァーグリーン阿佐ヶ谷1F,,false,tokyo,阿佐ヶ谷北部の住宅街にあるオーガニックスイーツのカフェ。店内で犬同伴が可能でわんこメニューも充実。,,,,,,,,,,,,,,,,true,,,true,,マット貸出・お水サービスあり(出典記載),2026-07-18,,
beef0000-0000-4000-8000-000000000400,,Dog Cafe Aloha ilio(アロハイーリオ),町田,35.55900,139.43600,東京都町田市本町田1880-3,,false,tokyo,保護犬活動を行うオーナーが営むハワイアンカフェ。小型犬向けのミニドッグランを併設し、愛犬と一緒に食事を楽しめる。,042-709-3990,,11:00〜17:00(土日祝は20:00まで),木曜定休,,,,,,,,https://dogcafe-alohailio.com/index.html,,,,true,true,true,true,,小型犬向けドッグランを併設(店内利用者限定)。大型犬はリード着用でドッグラン利用可。ワクチン接種済であること・他の犬を怖がらせたり執拗に追いかけないこと等のマナー条件あり(すべて公式サイト)。,2026-07-18,,
beef0000-0000-4000-8000-000000000401,,dog cafe petitchien(プティシアン),町田,35.55750,139.43400,東京都町田市本町田1129-1,,false,tokyo,高い天井でゆとりある店内とテラス・ロフト席を備えるドッグカフェ。ラム肉や馬肉を使った犬用メニューが充実している。,042-725-0919,,11:30〜17:00(L.O.16:00),月曜定休(変更あり),,,,,,,,https://dogcafe-petitchien.com/,,,,true,true,true,true,,テラス席・ロフト席は各6頭まで(店内は頭数の明記なし)。店内ではリードを手に持つか席の脚等に固定・マーキング癖がある犬はマナーベルト着用・排泄物は持ち帰り必須(すべて公式サイト)。,2026-07-18,,
beef0000-0000-4000-8000-000000000402,,CAFE花と海,町田,35.59800,139.46200,東京都町田市能ヶ谷1-13-4,,false,tokyo,小田急線鶴川駅近くの一軒家カフェ。看板犬とともに、酵素サラダなど体に優しいメニューを味わえる。,,,11:00〜15:00(L.O.14:30),水・木定休,,,,,,,,https://cafehanatoumi.amebaownd.com/,,,,true,true,true,,,,2026-07-18,,
beef0000-0000-4000-8000-000000000403,,Dog Cafe Uru(ドッグカフェ ウル),町田,35.52200,139.41800,東京都町田市木曽東2-5-1 ラポール町田1F,,false,tokyo,滑りにくい床材と全席のリードフックを備えた、犬に優しい設計のカフェ。,070-1265-7230,,11:00〜18:00(不定休),,,,,,,,,,@dogcafeuru,,,true,,true,true,,床は滑りにくい素材・全席リードフック完備・飲み水提供。バギー(犬用キャリー)での入店も可能。,2026-07-18,,
beef0000-0000-4000-8000-000000000404,,オルオルアイナ(Oluolu Aina),町田,35.58500,139.46800,東京都町田市大蔵町2790-1,,false,tokyo,ハワイ料理を提供するダイニングバー。屋根付きの白いウッドテラス席で愛犬と食事ができる。,042-708-9255,,9:00〜17:00(火曜定休)・金土は9:00〜21:00,火曜定休,,,,,,,,https://oluolu-aina.com/,,,,,true,true,,,ペットカートでの利用も可能。,2026-07-18,,
beef0000-0000-4000-8000-000000000405,,THE CITY BAKERY 南町田グランベリーパーク,町田,35.52900,139.44800,東京都町田市鶴間3-3-1 グランベリーパーク内,,false,tokyo,NY発のベーカリー&レストラン。屋外テラス40席で愛犬と食事ができる(店内は不可)。,042-850-7173,,ベーカリー・カフェ9:00〜21:00(レストランは平日11:00〜21:00・土日祝10:00開店・金土祝前日22:00閉店),,,,,,,,,https://thecitybakery.jp/shop/minamimachida.html,,,,false,true,,,,,2026-07-18,,
beef0000-0000-4000-8000-000000000406,,Snow Peak Cafe&Dining 南町田グランベリーパーク,町田,35.52900,139.44850,東京都町田市鶴間3-4-1 グランベリーパーク内,,false,tokyo,スノーピーク製品を用いたアウトドアテイストのレストラン。テラス席で愛犬と食事ができる(店内は不可)。,,,11:00〜20:00(料理L.O.19:00・ドリンクL.O.19:30),,,,,,,,,https://www.snowpeak.co.jp/news/p20230622/,,,,false,true,,true,,犬用フードメニュー(ビーフ・チキンの2種×S/M/Lサイズ)あり。,2026-07-18,,
beef0000-0000-4000-8000-000000000407,,WIRED KITCHEN 南町田グランベリーパーク,町田,35.52880,139.44820,東京都町田市鶴間3-4-1 グランベリーパークB1F,,false,tokyo,南町田グランベリーパーク内で数少ない、店内の一部エリアでも愛犬と過ごせるカフェ&レストラン。テラス席でも同伴可能。,,,11:00〜22:00,,,,,,,,,,,,,true,true,,,,店内は一部エリアのみペット同伴可(inutome.jp)。グランベリーパーク公式特集ページも店内同伴可能な店舗として紹介。denen-city.comはテラス利用時の案内が中心で店内可否への言及はなし。,2026-07-18,,
beef0000-0000-4000-8000-000000000408,,ファーマーズキッチン 南町田グランベリーパーク,町田,35.52870,139.44810,東京都町田市鶴間3-4-1 グランベリーパーク グリーンリビング1F,,false,tokyo,ガーデンセンターに隣接したイタリアンレストラン。テラス席で愛犬と食事ができる(店内は不可)。,042-850-7231,,11:00〜20:00,,,,,,,,,,,,,false,true,,,,,2026-07-18,,
beef0000-0000-4000-8000-000000000409,,ひつじのショーンビレッジ ショップ&カフェ 南町田グランベリーパーク,町田,35.52890,139.44830,〒194-0004 東京都町田市鶴間3-4-1 グランベリーパーク ワンダーシアター1F,,false,tokyo,『ひつじのショーン』の世界観を楽しめる日本初のミュージアムカフェ。テラス席で愛犬と食事ができる(店内は不可)。,042-850-6940,,10:00〜21:00(L.O.20:00)・テイクアウト11:00〜18:00,,,,,,,,,https://shaunvillage.jp/,,,,false,true,,,,,2026-07-18,,
beef0000-0000-4000-8000-000000000280,,VIRON 丸の内店,丸の内・神田,35.67854,139.76489,東京都千代田区丸の内2-7-3 東京ビルTOKIA 1F,,false,tokyo,東京駅そばTOKIA内にあるフランスパンとワインが自慢のブーランジェリー&ブラッスリー。テラス席限定で犬同伴が可能。,03-5220-7288,,ブーランジェリー・パティスリー9:00〜20:00(ブラッスリーは別途時間帯で営業),TOKIA(東京ビル)の休館日に準ずる(不定休),,,,,,,,,@viron_brasserie,,https://tabelog.com/tokyo/A1302/A130201/13043904/,false,true,true,,,,2026-07-18,,
beef0000-0000-4000-8000-000000000281,,P.C.M. パブ・カーディナル・マルノウチ,丸の内・神田,35.67858,139.76491,東京都千代田区丸の内2-7-3 東京ビルTOKIA 1F,,false,tokyo,丸の内・東京ビルTOKIA内の開放的なテラスが自慢のクラフトビール&パブダイニング。テラス席は犬などのペット同伴が可能。,03-5222-1251,,月〜土11:00〜翌4:00・日祝11:00〜22:00,ビル(TOKIA)の休館日に準ずる,,,,,,,,https://pcm-marunouchi.com/en_us/,,,,false,true,,,,犬以外の小動物(猫・フェレット等)も同伴可との紹介あり,2026-07-18,,
beef0000-0000-4000-8000-000000000282,,Osteria IL VIAGGIO,丸の内・神田,35.67930,139.76775,東京都千代田区丸の内1-9-1 グランルーフ2F(JR東京駅八重洲中央口改札外),,false,tokyo,東京駅八重洲口グランルーフ2階にある薪焼きイタリアン。テラス席は犬同伴で利用可能。,03-6627-2100,,月〜土・祝前日11:00〜23:00・日祝11:00〜22:00,,,,,,,,,,,,https://tabelog.com/tokyo/A1302/A130201/13286321/,false,true,true,,,テラスへの移動時、共用部(エスカレーター・階段等)ではキャリーバッグ等への収納が必要,2026-07-18,,
beef0000-0000-4000-8000-000000000283,,肉ビストロ&クラフトビール ランプラント(l'Empreinte),丸の内・神田,35.68010,139.76256,東京都千代田区丸の内2-2-3 丸の内仲通りビル1F,,false,tokyo,丸の内仲通り沿いの隠れ家的テラスで熟成肉やクラフトビールが楽しめるビストロ。テラス席で犬同伴可能・わんちゃん専用ステーキも用意。,050-5462-2816,,平日ランチ11:30〜14:30(L.O.14:00)・平日ディナー17:30〜23:00(L.O.22:00)/土日祝ランチ11:30〜15:30(L.O.15:00)・土日祝ディナー17:30〜21:30(L.O.21:00),施設(ビル)に準ずる・年末年始休業(要確認),,,,,,,,https://lempreinte.foodre.jp/,,,,false,true,true,true,,わんちゃん専用のステーキメニューあり(公式サイトより),2026-07-18,,
beef0000-0000-4000-8000-000000000284,,ジャンピングパンダ(丸の内テラス),丸の内・神田,35.68428,139.76404,東京都千代田区丸の内1-3-4 丸の内テラス1F,,false,tokyo,丸の内テラスにある四川料理のカジュアル中華バル。ペット同伴時はテラス席限定での利用。,03-6206-3920,,月〜金11:30〜14:30・17:30〜23:00/土日12:00〜15:30・16:00〜21:30/祝日11:30〜15:00・16:00〜21:30,ビル(丸の内テラス)に準ずる・年末年始休業,,,,,,,,https://akr3565174053.owst.jp/,,,,false,true,true,,,,2026-07-18,,
beef0000-0000-4000-8000-000000000285,,ブラッスリー セント・ベルナルデュス 神田(St.Bernardus),丸の内・神田,35.69058,139.76972,東京都千代田区内神田3-6-2 アーバンネット神田ビル1F,,false,tokyo,神田駅そばのベルギービール醸造所の名を冠したブラッスリー。ペット同伴可(専門サイトの案内ではテラス席限定)。,050-5487-9569,,月〜金 昼11:30〜15:00(L.O.14:30)・夜17:00〜23:00(L.O.22:30)/土日祝11:30〜23:00(L.O.22:30),不定休・年末年始休業,,,,,,,,https://p651619.gorp.jp/,,,,,true,,,,公式は無限定の「ペット同伴OK(詳細は問い合わせ)」、pet-restaurant.comはテラス限定と記載。店内可否は要確認,2026-07-18,,
beef0000-0000-4000-8000-000000000286,,CIRCULO(シルクロ),丸の内・神田,35.68366,139.76467,東京都千代田区丸の内1-4-5 三菱UFJ信託銀行本店ビルB1F,,false,tokyo,丸の内・三菱UFJ信託銀行本店ビル地下のフランス料理店。ウッドデッキのテラス席は大型犬まで同伴可能(店内は不可)。,03-5222-6033,,平日ランチ11:00〜14:30(L.O.13:30)・平日ディナー17:30〜22:00(L.O.フード20:00/ドリンク21:30)/土祝ランチ11:00〜14:30(L.O.13:00)・土祝ディナー17:30〜22:00(L.O.21:00),日曜定休,,,,,,,,https://wehavesomething.wixsite.com/circulo,,,https://tabelog.com/tokyo/A1302/A130201/13267769/,false,true,true,,,,2026-07-18,,
beef0000-0000-4000-8000-000000000460,,Terrie's Dog Cafe そら〜ず,中野,35.69600,139.67600,東京都中野区中央5-10-15,,false,tokyo,犬の食育士がオーナーを務める一軒家のドッグカフェ。ノーリードで愛犬とくつろげる、新中野・中野駅からのんびり歩ける住宅街の隠れ家。,,,平日16:00〜22:00・土日祝13:00〜22:00,月曜定休,定休,,,,,,,https://sora0114mako0609.com/dogcafe/,,,https://tabelog.com/en/tokyo/A1319/A131902/13202073/,true,,true,true,,リード不要(ノーリード可)で店内利用可。狂犬病・混合ワクチン接種(1年以内)未接種、トイレのしつけ未完了、ヒート中の犬は利用不可(公式サイトより)。,2026-07-18,,
beef0000-0000-4000-8000-000000000461,,anea cafe 中野新橋店,中野,35.69050,139.67650,東京都中野区本町5-3-8 中野新橋ビル1F,,false,tokyo,中野新橋駅すぐの、犬・猫など幅広いペットと過ごせるカフェ&バー。木のぬくもりある店内は全席ペット同伴可で専用メニューも用意。,03-6382-7928,,11:30〜26:00,無休,,,,,,,,https://anea.jp/,@aneacafe_nakanoshinbashi,,https://tabelog.com/en/tokyo/A1319/A131903/13152894/,true,true,true,true,,リード・マナーベルト着用必須。ヒート中の犬は利用不可(Honda Dog公式サイトより)。,2026-07-18,,
beef0000-0000-4000-8000-000000000462,,GOOD MORNING CAFE 中野セントラルパーク,中野,35.70950,139.66600,東京都中野区中野4-10-2 中野セントラルパークサウス1F,,false,tokyo,中野四季の森公園に面したイタリアン&バルスタイルのカフェ。開放的なテラス席で緑を眺めながら朝食からディナーまで楽しめる。,050-5488-4492,,平日11:00〜22:00(料理L.O.20:30・ドリンクL.O.21:00)・土日祝8:30〜22:00(同L.O.),,,,,,,,,https://gmc-nakano.com/,@gmc__nakano,,https://tabelog.com/en/tokyo/A1319/A131902/13147583/,false,true,,,,テラス席のみ犬同伴可(店内不可)。大型犬可否・頭数上限の記載なし。,2026-07-18,,
beef0000-0000-4000-8000-000000000463,,gufo(グーフォ),中野,35.71850,139.64850,東京都中野区野方5-26-3 パークサイド野方1F,,false,tokyo,ペット用品・雑貨・絵本の販売とカフェを併設した野方の店。動物と人をつなぐコンセプトで、犬・猫と一緒に立ち寄れる。,,,10:30〜19:00,火曜定休・第2第4月曜定休,,定休,,,,,,https://gufo.jp/,@nogatagufo,,https://tabelog.com/tokyo/A1321/A132104/13253094/,true,,,,,お座敷席に上がる際は足を拭きタオル等の敷物を用意(中野区公式サイトより)。ペット撮影会等のイベント時は事前にInstagram等で要確認。,2026-07-18,,
beef0000-0000-4000-8000-000000000464,,LOU,中野,35.70900,139.66500,東京都中野区中野5-53-4,,false,tokyo,パドラーズコーヒー2号店として中野北口の路地裏にあるスタイリッシュなカフェ。焙煎コーヒーと焼き菓子が人気でテラス席あり。,,,月火木金9:00〜16:00・土日8:00〜16:00,水曜定休,,,定休,,,,,,,,https://tabelog.com/en/tokyo/A1319/A131902/13261085/,false,true,,,,テラス席のみ犬同伴可(店内不可)。,2026-07-18,,
beef0000-0000-4000-8000-000000000465,,ヨガカフェ,中野,35.69500,139.67950,東京都中野区本町2-45-2 1F,,false,tokyo,中野坂上の路地にあるヨガスタジオ併設カフェ。きのこカレーが看板メニューで、店頭テラス席のみ犬同伴可能。,,,月水木金11:00〜13:30(L.O.13:00)・土日祝11:00〜15:00(L.O.14:30),,,,,,,,,,,,https://tabelog.com/tokyo/A1319/A131903/13142635/,false,true,,,テラス席2人掛け×2卓のみ(少人数限定),店頭テラス席(2人掛け×2卓)のみ犬同伴可。,2026-07-18,,
beef0000-0000-4000-8000-000000000480,,窯焼きバルカフェ らんぷ+k,押上・錦糸町,35.71080,139.81200,東京都墨田区業平1-22-5 1F,,false,tokyo,押上駅近くでスカイツリーを望むテラス席がある発酵×窯焼きピッツァのバルカフェ。テラス席は犬同伴可・小型犬は抱っこで店内利用も可。,03-5637-8308,,月・水・木11:30〜14:00／17:00〜23:00・金11:30〜14:00／17:00〜24:00・土日11:30〜24:00・祝11:30〜23:00,火曜定休(祝日の場合は翌水曜日),,,,,,,,https://lamp-oshiage.com/,,,,true,true,,,小型犬はテラス・店内(抱っこ)可・中型犬はテラスのみ・カラーとリード持参必須,店内は席が手狭なためテラス席を推奨(店内利用時は抱っこ必須),2026-07-18,,
beef0000-0000-4000-8000-000000000481,,ENRICH,押上・錦糸町,35.71130,139.81450,東京都墨田区業平4-15-9 三谷ビル1F,,false,tokyo,押上駅近くのオールデイダイニングカフェ。ナチュラルワインや多国籍料理が楽しめ、小〜中型犬同伴で店内利用ができる。,03-6456-1621,,月9:00〜16:00・火〜金9:00〜16:00／18:00〜22:00・土日祝9:00〜22:00,不定休,,,,,,,,,,,https://tabelog.com/tokyo/A1312/A131203/13299616/,true,,,,小型〜中型犬まで,,2026-07-18,,
beef0000-0000-4000-8000-000000000482,,PENNY LANE ソラマチ店,押上・錦糸町,35.71010,139.80980,東京都墨田区押上1-1-2 東京ソラマチ,,false,tokyo,東京スカイツリータウン内のベーカリー&パブリック。館内への犬同伴は不可だが、併設のテラス席は犬同伴で利用できる。,03-5608-1960,,ベーカリー9:00〜21:00・パブリック17:00〜22:00(L.O.21:00),定休日なし(東京ソラマチに準ずる),,,,,,,,https://pennylane.company/solamachi,@penny_lane_soramachi,,https://tabelog.com/tokyo/A1312/A131203/13271434/,false,true,,,,東京ソラマチ館内は犬同伴不可・店舗外のテラス席のみ利用可(満席時はソラマチ広場のオープンテラスも利用可とスタッフ案内あり),2026-07-18,,
beef0000-0000-4000-8000-000000000483,,犬茶屋本舗,押上・錦糸町,35.69350,139.79750,東京都墨田区立川3-10-8 パイロットハウス1階,,false,tokyo,古都京都の一戸建てをイメージした黒塗りの外観が目印の和風ドッグカフェ。店内・テラスとも犬同伴可能で、自家製の犬用メニューも豊富。,03-6413-0035,,12:00〜19:00(L.O.18:00)(出典により11:30〜17:00・11:00〜16:00等の記載もあり、要現地確認),木曜定休,,,,,,,,,,,https://tabelog.com/tokyo/A1312/A131201/13096167/,true,true,true,true,中・大型犬もOK,トイレのしつけ必須・予防接種必須・無駄吠えのしつけ必須・ヒート(発情中)の利用不可・リード使用必須・店内はペット可席と一般席に分かれている,2026-07-18,,
beef0000-0000-4000-8000-000000000484,,マキネスティコーヒー 緑本店,押上・錦糸町,35.69350,139.80550,東京都墨田区緑3-11-5,,false,tokyo,錦糸町と両国の間にある本格スペシャルティコーヒーの自家焙煎店。犬同伴に関する個人ブログの紹介はあるが公式方針としては未確認。,03-3846-4321,,10:00〜19:00(L.O.18:30),火曜定休,,,,,,,,https://macchinesticoffee.co.jp/pages/shop,,,,,,,,,店内可否は2018年の個人ブログ体験談1件のみが根拠で店の公式方針の明記ではない。同店には「緑本店」と「テルミナ店」があり、出典はいずれも「緑本店」を名指ししておらず住所からの推定。要現地確認(公式サイトにペット記載なし),2026-07-18,,
beef0000-0000-4000-8000-000000000200,,a-bridge 三軒茶屋店,三軒茶屋・下北沢,35.64320,139.66982,東京都世田谷区三軒茶屋2-14-12 三元ビルRF,,false,tokyo,三軒茶屋駅近くのビル屋上にある隠れ家風カフェ&ダイニングバー。店内・屋上テラスとも犬同伴可能。,03-3418-5013,,12:00〜24:00,水曜定休,,,,,,,,,@abridge2001,,https://tabelog.com/tokyo/A1317/A131706/13021821/,true,true,,,,,2026-07-18,,
beef0000-0000-4000-8000-000000000201,,FUNGO 三宿本店,三軒茶屋・下北沢,35.64176,139.68090,東京都世田谷区下馬1-40-10,,false,tokyo,世田谷公園そばで長年営業するサンドイッチ&ハンバーガー専門店。テラス席は大型犬まで同伴可能(店内は不可)。,03-3795-1144,,10:00〜21:00(L.O.20:00),年末年始休業,,,,,,,,https://www.fungo.com/,@cafe_fungo,,,false,true,true,,,大型犬もテラス席なら同伴可(店内は不可),2026-07-18,,
beef0000-0000-4000-8000-000000000202,,イル ピッツァイオーロ(il Pizzaiolo),三軒茶屋・下北沢,35.64451,139.66876,東京都世田谷区太子堂4-20-7,,false,tokyo,薪窯で焼くナポリピッツァが評判の三軒茶屋のピッツェリア。テラス席のみ犬同伴可能(店内は不可)。,03-3411-5556,,火〜土11:30〜15:00・18:00〜22:30/日11:30〜15:00・18:00〜22:00,月曜定休(他不定休あり),,,,,,,,https://ilpizzaiolo.amebaownd.com/,@il_pizzaiolo_,,https://tabelog.com/tokyo/A1317/A131706/13013741/,false,true,,,,,2026-07-18,,
beef0000-0000-4000-8000-000000000203,,スパイスバル317(サンイチナナ),三軒茶屋・下北沢,35.64087,139.67401,東京都世田谷区三軒茶屋1-7-12,,false,tokyo,20種類以上のスパイスを使うカレー・タパスが楽しめるバル。店内は一部の席のみ犬同伴可能。,03-6450-8850,,月・水〜金17:00〜24:00/土11:30〜24:00/日・祝11:30〜23:00,火曜定休(祝日の場合は営業),,,,,,,,,@spicebar317,,,true,,,,,店内は扉が開いている時のみ・一部席のみ犬同伴可,2026-07-18,,
beef0000-0000-4000-8000-000000000204,,cafe garage Dogberry(ドッグベリー)下北沢,三軒茶屋・下北沢,35.66313,139.66692,東京都世田谷区北沢2-29-16 高木ビル1F,,false,tokyo,アメリカンガレージ風の内装が特徴のカフェ&ダイニングバー。店内・テラス席とも犬同伴可能。,050-5488-2500,,モーニング9:00〜11:00・ランチ11:00〜17:30・ディナー17:30〜24:00,無休,,,,,,,,https://ggs6200.gorp.jp/,,,,true,true,,,,ドッグカフェではないため犬用メニュー等の特別サービスは無し(詳細は要問合せ)。大型犬は要問合せ(petokoto),2026-07-18,,
beef0000-0000-4000-8000-000000000205,,tag cafe(タグカフェ),三軒茶屋・下北沢,35.66094,139.66801,東京都世田谷区北沢2-12-10 サウスサイドII 2B,,false,tokyo,下北沢駅東口徒歩1分のレトロな喫茶店。店内で犬同伴可能。,03-6450-7253,,11:00〜20:00(L.O.19:30),無休,,,,,,,,,@tagcafe_shimokita,,,true,,,,,,2026-07-18,,
beef0000-0000-4000-8000-000000000206,,織部 下北沢店(オリベ),三軒茶屋・下北沢,35.65959,139.66812,東京都世田谷区北沢2-2-3 1F,,false,tokyo,若手陶芸家の和食器を扱うギャラリー併設カフェ。テラス席のみ犬同伴可能(店内は器の展示販売エリアのため不可)。,03-5432-9068,,11:00〜19:00(L.O.18:30),無休(元日のみ休業),,,,,,,,,,,,false,true,,,,テラス席は雨天時もビニール・屋根ありで利用可,2026-07-18,,
beef0000-0000-4000-8000-000000000207,,Waffle cafe ORANGE(ワッフルカフェ・オランジ),三軒茶屋・下北沢,35.66265,139.66656,東京都世田谷区北沢2-26-21 エルファアシティ下北沢1F,,false,tokyo,手作りワッフルが人気のカフェ。テラス席のみ犬同伴可能で大型犬もOK(店内は不可)。,03-5738-5320,,11:00〜19:00,元日休業,,,,,,,,,@waffle_cafe_orange,,https://tabelog.com/tokyo/A1318/A131802/13015567/,false,true,true,,,,2026-07-18,,
beef0000-0000-4000-8000-000000000320,,SHARK COFFEE,渋谷駅周辺,35.66350,139.69820,〒150-0042 東京都渋谷区宇田川町2-1 渋谷ホームズ1F,,false,tokyo,渋谷公園通り沿いのヴィーガン系コーヒースタンド。50席以上の広い店内でソファー席以外は犬同伴可能。,,,9:00〜19:00(L.O.18:30),無休,,,,,,,,https://sharkcoffee.store/,@sharkcoffee_shibuya,,https://tabelog.com/en/tokyo/A1303/A130301/13283725/,true,true,false,true,,ソファー席は犬同伴不可・ワンちゃん用マット貸出とお水の用意あり,2026-07-18,,
beef0000-0000-4000-8000-000000000321,,THE LINKING,渋谷駅周辺,35.66140,139.69780,東京都渋谷区神南1-14-9 第7FMGビル1F,,false,tokyo,神南のアメリカンダイナー。アンガス牛のチャックテールステーキが看板で、店内での犬同伴に対応。,03-6416-5882,,月・火・木・金17:00〜23:00・土日祝11:00〜23:00,水曜定休,,,,,,,,https://linkinggroup.jp/the-linking/,@the_linking_,,,true,false,,,,大型犬可否は出典間で一致せず(詳細は出典参照)・犬種条件は要問合せ,2026-07-18,,
beef0000-0000-4000-8000-000000000322,,Whitely Cafe,渋谷駅周辺,35.66500,139.69650,東京都渋谷区神南1-6-14 ジョルディビル1F,,false,tokyo,代々木公園に近い神南の完全予約制カフェ&バー。白を基調にした店内に小さな滝が流れ、犬同伴でくつろげる。,,完全予約制(Instagram DMのみ),CAFE 10:30〜18:00・BAR 18:00〜22:00,,,,,,,,,,@whitely_cafe,,,true,,false,true,,,2026-07-18,,
beef0000-0000-4000-8000-000000000323,,good fellas,渋谷駅周辺,35.65590,139.69600,東京都渋谷区円山町7-11 梅北ビル3F,,false,tokyo,円山町(神泉)にあるカフェ&バー。深夜まで営業しており、渋谷駅から徒歩圏で仕事帰りにも立ち寄れる。,03-6277-5543,,月〜土12:00〜16:00・18:00〜翌5:00,日曜定休,,,,,,,,,,,https://tabelog.com/en/tokyo/A1303/A130301/13156028/,true,false,false,,,3階のため小型犬はカート等での来店が望ましい,2026-07-18,,
beef0000-0000-4000-8000-000000000324,,Dog Salon & Cafe Karin堂,渋谷駅周辺,35.65580,139.69750,東京都渋谷区桜丘町7-13,,false,tokyo,桜丘町のドッグサロン併設カフェ。オーガニック野菜中心の料理と、犬同伴でくつろげる店内席が特徴。,03-3461-6956,,平日12:00〜15:00(ランチ)・15:00〜19:00(ディナー)・第2/4土曜13:00〜15:00(ランチ)・15:00〜18:00(ディナー),第1・3・5土曜/日曜/祝日定休,,,,,,,,,,,,true,,true,true,,総席数18席のうち犬同伴可18席,2026-07-18,,
beef0000-0000-4000-8000-000000000325,,mum coffee,渋谷駅周辺,35.65490,139.69700,東京都渋谷区桜丘町10-6 1F,,false,tokyo,桜丘町にある小さなコーヒースタンド。焼き菓子やアサイーボウルを提供する、犬連れ散歩の合間に立ち寄れるカフェ。,,,平日8:30〜18:00・土日11:00〜18:00,月曜定休,,,,,,,,,@mumcoffeeshibuya,,,true,,true,,,,2026-07-18,,
